Date,Article title,Article sentiment
2024-06-24T11:35:00.000Z,DocGo Secures Five New Contracts to Provide Healthcare In Markets Across the United States,positive
2024-06-20T11:35:00.000Z,"DocGo to Participate in the iAccess Alpha Buyside Best Ideas Summer Conference 2024 on June 25 and 26, 2024",neutral
2024-06-17T11:35:00.000Z,DocGo Establishes Medical Advisory Board,positive
2024-06-11T11:35:00.000Z,DocGo Named in U.S. News & World Report’s 2024-2025 Best Companies to Work For,positive
2024-06-06T12:25:39.000Z,Why DocGo Inc. (NASDAQ:DCGO) Could Be Worth Watching,negative
